{
  "schema": "mantle-dev-stage-resume-report-v1",
  "status": "dev-only",
  "mode": "dev",
  "plan_digest_blake3": "aaaaaaaaaaaaaaaaaaaaaaaaaaaaaaaaaaaaaaaaaaaaaaaaaaaaaaaaaaaaaaaa",
  "selected_bundle_identity_blake3": "bbbbbbbbbbbbbbbbbbbbbbbbbbbbbbbbbbbbbbbbbbbbbbbbbbbbbbbbbbbbbbbb",
  "published_bundle_identities_blake3": [],
  "restored_stages": [
    "stagex-transition",
    "stagex-provider",
    "full-source-native-provider",
    "full-source-rust-provider"
  ],
  "executed_stages": [
    "mantle-stage1",
    "mantle-stage2"
  ],
  "first_incomplete_stage": "mantle-stage1",
  "rejected_candidates": [
    {
      "bundle_identity_blake3": "cccccccccccccccccccccccccccccccccccccccccccccccccccccccccccccccc",
      "completed_stage": "stagex-provider",
      "reason": "manifest-invalid"
    }
  ],
  "cache_adoption_disposition": "resume-restored",
  "promoted_receipt_written": false,
  "release_alias_updated": false,
  "non_claims": [
    "restored stages were not executed again in this attempt",
    "dev resume does not satisfy a promoted fixed-point proof",
    "runtime confirmation is bounded to the recorded source profile, host, plan, and policy"
  ]
}
